{
  "$schema": "https://json-schema.org/draft/2020-12/schema",
  "$id": "https://purposesource.org/spec/schemas/ct-segment.v1.json",
  "title": "Transparency-log segment — /ct/{n}.json and /ct/latest.json",
  "description": "One segment of the append-only certificate transparency log. Structure for v1 is a flat signed append-only log plus checkpoints (CERT-034 default; a Merkle upgrade would add an inclusion-proof field additively — URS §21 OPEN-37). Closed segments hold exactly 10000 entries and are chained by hash; `/ct/latest.json` is the OPEN segment in the identical shape (FS08-111).\n\nEntries carry hash, type, kind, reference and timestamp and NOTHING ELSE — no names, no emails, no subject data. That is what makes the log GDPR-compatible by content and therefore immutable forever, including through an erasure request (CERT-031, CERT-045).\n\nAt P-M2 the log is exactly one committed file, `ct/0.json` at the website repository root, appended by pull request; CI rejects any diff that edits or deletes an existing entry, which makes append-only a mechanical property rather than a promise (FS08-113, VS-28). A revocation or status change is a NEW entry whose `ref` is the ORIGINAL entry's hash — the log never edits (CERT-033). So is a `record` entry (1.4.0): the registry's statement that the credential whose `issue` entry it references was recorded at its `ts`, the instant a waiver starts to cover (D68 item 8; `waiver.v1` 1.3.0).",
  "x-psn": {
    "specVersion": "1.4.0",
    "phase": "P-M2 (single committed segment 0)",
    "artifactPath": "/ct/{n}.json · /ct/latest.json",
    "authoritative": true,
    "producer": "P-M2: operator script via PR (VS-27/VS-28) · P-M3: ct-publish authors, index-build writes",
    "consumers": ["verify page inclusion check (VS-25)", "independent auditors", "the public git mirror (CERT-032)"],
    "fsRefs": ["FS-00 §6.2", "FS-08 §12 (FS08-110…FS08-114)", "CERT-030…CERT-034", "D68 item 8", "D71 item 1"],
    "vsRefs": ["VS-27", "VS-28", "VS-25"],
    "changelog": "CHANGELOG.md#ct-segmentv1json"
  },
  "type": "object",
  "additionalProperties": false,
  "required": ["schemaVersion", "segment", "startSeq", "prevSegmentSha256", "entries"],
  "properties": {
    "schemaVersion": { "const": 1 },
    "segment": { "type": "integer", "minimum": 0, "description": "Segment number. Segment 0 is the P-M2 committed file and is carried forward unchanged at P-M3 so v0 entries stay verifiable (FS08-113)." },
    "startSeq": { "type": "integer", "minimum": 0, "description": "Global sequence number of this segment's first entry. Sequence is global and monotonic across segments." },
    "prevSegmentSha256": {
      "type": ["string", "null"],
      "pattern": "^[0-9a-f]{64}$",
      "description": "SHA-256 of the previous segment document, or null for segment 0. Re-walking these hashes must reproduce the chain — divergence pages ops (FS08-114/135)."
    },
    "generatedAt": {
      "type": "string",
      "format": "date-time",
      "description": "Present on the open segment (`latest.json`). A CLOSED segment is frozen byte-for-byte the moment it fills, so it deliberately carries no regeneration timestamp — its immutability is the point."
    },
    "source": { "enum": ["registry-v0", "sample", "fixture", "platform"], "description": "Which plane produced this artifact. `sample` and `fixture` declare a NON-PRODUCTION plane: every page that renders such an artifact is labelled sample, and a production deployment refuses to serve it (FS-10 §2 v0 note; the edge route answers `sandbox_artifact_on_prod`). `registry-v0` is the P-M2 production source of record — the curated registry repository the index is built from. `platform` is the P-M3 producer of record — the platform database, rendered by `jobs.index-build`. Optional, and its absence asserts nothing: an artifact whose body cannot carry the label borrows the plane's declaration from `/registry/index/meta.json`. The enum widens additively when the P-M3 producer takes a value of its own, and `platform` (2026-09-12) is that widening: `jobs.index-build` writes it in `PSN_ENV=prod` and writes `fixture` in every other environment, so a reader can still tell a production plane from a synthetic one by the label alone." },
    "closed": { "type": "boolean", "description": "True once the segment reached its fixed entry count and was frozen." },
    "entries": {
      "type": "array",
      "maxItems": 10000,
      "items": { "$ref": "#/$defs/entry" }
    }
  },
  "$defs": {
    "entry": {
      "type": "object",
      "additionalProperties": false,
      "required": ["seq", "h", "typ", "kind", "ref", "ts"],
      "description": "One log entry. `ref` is explicitly REQUIRED and nullable rather than optional, so an issue entry states plainly that it references nothing — a missing key and a null must not be distinguishable in an audit.",
      "properties": {
        "seq": { "type": "integer", "minimum": 0 },
        "h": {
          "$ref": "#/$defs/sha256",
          "description": "For `issue`: SHA-256 of the compact JWS string (CERT-030). For `revoke`/`status`/`record`: SHA-256 of the entry payload — at v0 that payload is THIS entry's own members other than `seq` and `h`, serialised as RFC 8785 (JCS) canonical JSON, `{\"kind\":\"revoke\",\"ref\":\"<the original entry's h>\",\"ts\":\"<RFC 3339>\",\"typ\":\"<family>\"}` (with `\"kind\":\"record\"` for a `record` entry), with `h` the lowercase-hex SHA-256 of its UTF-8 bytes. It is not a separately signed object: a signed revocation family is P-M3, and the entry's own bytes are what exists at v0. `seq` is excluded because the log assigns it at append time — hashing it would make an entry's identity depend on where it landed, and would make every revocation trivially distinct, emptying the distinct-hash rule that catches one revocation logged twice. So `h` and `ref` are never equal: a revocation is a NEW object (CERT-033), not a second pointer at the object it revokes."
        },
        "typ": { "enum": ["contributor", "steward", "supporter", "license-status", "topup", "entitlement-record", "ct-checkpoint"], "description": "JWS family — the first five values are the frozen certificate types (FS-00 §6.4), the last two the other signed families the log records: the entitlement record published at its own URL and the log's own checkpoint, both CT-appended by the v0 operator script (FS08-113, VS-27). A family is not personal data; no subject field ever enters this log." },
        "kind": { "enum": ["issue", "revoke", "status", "record"], "description": "`issue`: a credential entered the log. `revoke`: it was revoked, from this entry's `ts` (for a waiver certificate, the waiver's revocation instant, D71 item 1). `status`: another change of its status. `record` (1.4.0): the registry recorded the credential whose `issue` entry `ref` names — its public entry and this log's `issue` entry for it were published — and this entry's `ts` is that recording instant. Today only a `license-status` certificate of variant `waiver` is recorded, and the waiver's published `grantedAt` equals this `ts` (D68 item 8; `waiver.v1` 1.3.0). A log holds at most ONE `record` entry per referenced entry, and its `ref` always names an earlier `issue` entry; a reader refuses a log that breaks either rule. A `record` entry carries the same six members as every other entry and nothing else: no name, no subject." },
        "ref": { "type": ["string", "null"], "pattern": "^[0-9a-f]{64}$", "description": "The ORIGINAL entry's hash for `revoke`/`status`; for `record`, the `h` of the `issue` entry it records; null for `issue` (CERT-033)." },
        "ts": { "type": "string", "format": "date-time" }
      },
      "allOf": [
        {
          "if": { "properties": { "kind": { "const": "record" } }, "required": ["kind"] },
          "then": { "properties": { "ref": { "type": "string" } } }
        }
      ]
    },
    "sha256": { "type": "string", "pattern": "^[0-9a-f]{64}$" }
  }
}
