{
  "schemaVersion": 1,
  "segment": 0,
  "startSeq": 0,
  "prevSegmentSha256": null,
  "generatedAt": "2027-06-01T06:00:00Z",
  "closed": false,
  "entries": [
    {
      "seq": 0,
      "h": "5c1a8f3e2d0b9c7a6e5d4f3b2a1908675c1a8f3e2d0b9c7a6e5d4f3b2a190867",
      "typ": "supporter",
      "kind": "issue",
      "ref": null,
      "ts": "2027-03-01T09:00:00Z"
    },
    {
      "seq": 1,
      "h": "2d26217db718560c138d6b63d164b8b9002df9f21d9ae39b516c454b3e581129",
      "typ": "supporter",
      "kind": "revoke",
      "ref": "5c1a8f3e2d0b9c7a6e5d4f3b2a1908675c1a8f3e2d0b9c7a6e5d4f3b2a190867",
      "ts": "2027-03-01T12:00:00Z"
    },
    {
      "seq": 2,
      "h": "a1b2c3d4e5f60718293a4b5c6d7e8f90a1b2c3d4e5f60718293a4b5c6d7e8f90",
      "typ": "license-status",
      "kind": "issue",
      "ref": null,
      "ts": "2027-04-01T00:00:00Z"
    },
    {
      "seq": 3,
      "h": "d223b65257d75da16787affaac021783a5b5f309d71bff1e16f9540e48457d5d",
      "typ": "license-status",
      "kind": "record",
      "ref": "a1b2c3d4e5f60718293a4b5c6d7e8f90a1b2c3d4e5f60718293a4b5c6d7e8f90",
      "ts": "2027-04-01T00:05:00Z"
    }
  ]
}
